<?xml version="1.0" encoding="UTF-8"?>
<xs:schema xmlns:xs="http://www.w3.org/2001/XMLSchema" elementFormDefault="qualified">
    <xs:element name="QuanLyNhanVien">
        <xs:complexType>
            <xs:sequence>
                <xs:element name="sinhvien" maxOccurs="unbounded">
                    <xs:complexType>
                        <xs:sequence>
                            <xs:element name="MSSV">
                                <xs:simpleType>
                                    <xs:restriction base="xs:string">
                                        <xs:pattern value="\d{7}"></xs:pattern>
                                    </xs:restriction>
                                </xs:simpleType>
                            </xs:element>
                            <xs:element name="HoTen" type="xs:string"></xs:element>
                            <xs:element name="Lop">
                                <xs:simpleType>
                                    <xs:restriction base="xs:string">
                                        <xs:pattern value="CTK28|CTK28CD|CTK29|CTK29CD|CTK30"></xs:pattern>
                                    </xs:restriction>
                                </xs:simpleType>
                            </xs:element>
                            <xs:element name="MonHoc" maxOccurs="unbounded">
                                <xs:complexType>
                                    <xs:sequence>
                                        <xs:element name="MaMonHoc">
                                            <xs:simpleType>
                                                <xs:restriction base="xs:string">
                                                    <xs:pattern value="[A-z][A-z][0-9][0-9]"></xs:pattern>
                                                </xs:restriction>
                                            </xs:simpleType>
                                        </xs:element>
                                        <xs:element name="TenMonHoc" type="xs:string"></xs:element>
                                        <xs:element name="SoTinChi">
                                            <xs:simpleType>
                                                <xs:restriction base="xs:decimal">
                                                    <xs:minInclusive value="1.5"></xs:minInclusive>
                                                    <xs:maxExclusive value="5"></xs:maxExclusive>
                                                </xs:restriction>
                                            </xs:simpleType>
                                        </xs:element>
                                        <xs:element name="DiemmThi">
                                            <xs:simpleType>
                                                <xs:restriction base="xs:decimal">
                                                    <xs:minInclusive value="0"></xs:minInclusive>
                                                    <xs:maxExclusive value="10"></xs:maxExclusive>
                                                </xs:restriction>
                                            </xs:simpleType>
                                        </xs:element>
                                    </xs:sequence>
                                </xs:complexType>
                            </xs:element>
                        </xs:sequence>
                    </xs:complexType>
                </xs:element>
            </xs:sequence>
        </xs:complexType>
    </xs:element>
</xs:schema>
