<?xml version="1.0" encoding="UTF-8"?>
<QuanLyNhanVien xmlns:xsi="http://www.w3.org/2001/XMLSchema-instance"
 xsi:noNamespaceSchemaLocation="file:/D:/Projects/BaiTapXML/chuong4-bai1/QLSV.xsd">
    <sinhvien>
        <MSSV>0000000</MSSV>
        <HoTen>HoTen0</HoTen>
        <Lop>CTK28</Lop>
        <MonHoc>
            <MaMonHoc>AA00</MaMonHoc>
            <TenMonHoc>TenMonHoc0</TenMonHoc>
            <SoTinChi>2.75</SoTinChi>
            <DiemmThi>4.5</DiemmThi>
        </MonHoc>
        <MonHoc>
            <MaMonHoc>AA00</MaMonHoc>
            <TenMonHoc>TenMonHoc1</TenMonHoc>
            <SoTinChi>2.75</SoTinChi>
            <DiemmThi>4.5</DiemmThi>
        </MonHoc>
    </sinhvien>
    <sinhvien>
        <MSSV>0000000</MSSV>
        <HoTen>HoTen1</HoTen>
        <Lop>CTK28</Lop>
        <MonHoc>
            <MaMonHoc>AA00</MaMonHoc>
            <TenMonHoc>TenMonHoc2</TenMonHoc>
            <SoTinChi>2.75</SoTinChi>
            <DiemmThi>4.5</DiemmThi>
        </MonHoc>
        <MonHoc>
            <MaMonHoc>AA00</MaMonHoc>
            <TenMonHoc>TenMonHoc3</TenMonHoc>
            <SoTinChi>2.75</SoTinChi>
            <DiemmThi>4.5</DiemmThi>
        </MonHoc>
    </sinhvien>
</QuanLyNhanVien>
